{
  "$schema": "https://json-schema.org/draft/2020-12/schema",
  "$id": "https://github.com/carloseduardo00/mu-explorer/schema/source.schema.json",
  "title": "Source",
  "description": "Fonte de dados e período de coleta.",
  "type": "object",
  "additionalProperties": false,
  "required": [
    "id",
    "name",
    "url",
    "credit",
    "pages",
    "first_scraped_at",
    "last_scraped_at"
  ],
  "properties": {
    "id": {
      "type": "string",
      "pattern": "^[a-z0-9_]+$"
    },
    "name": {
      "type": "string",
      "minLength": 1
    },
    "url": {
      "type": "string",
      "pattern": "^https?://"
    },
    "credit": {
      "type": [
        "string",
        "null"
      ],
      "minLength": 1
    },
    "pages": {
      "type": "integer",
      "minimum": 0
    },
    "first_scraped_at": {
      "type": [
        "string",
        "null"
      ],
      "pattern": "^\\d{4}-\\d{2}-\\d{2}T\\d{2}:\\d{2}:\\d{2}Z$"
    },
    "last_scraped_at": {
      "type": [
        "string",
        "null"
      ],
      "pattern": "^\\d{4}-\\d{2}-\\d{2}T\\d{2}:\\d{2}:\\d{2}Z$"
    },
    "revision": {
      "description": "Versão exata da fonte (ex.: commit do repositório), quando houver.",
      "type": [
        "string",
        "null"
      ],
      "minLength": 1
    }
  }
}
