[
{"id":"muemu","name":"MuEmu (emulador open source)","url":"https://github.com/deep-thought-42/MuEmu","credit":"Dados de arquivos do MuEmu (github.com/deep-thought-42/MuEmu, licença MIT). Dados de servidor privado.","pages":3,"first_scraped_at":"2026-10-21T13:25:11Z","last_scraped_at":"2026-10-21T13:25:11Z"}
]
