[
{"id":"guidemu","name":"Guide MU Online","url":"https://guidemuonline.com","credit":"Mapas, spots e monstros do Guide MU Online (guidemuonline.com), guia do MU Online oficial. Publicados com autorização.","pages":43,"first_scraped_at":"2026-10-22T13:08:01Z","last_scraped_at":"2026-10-22T13:08:01Z"}
]
