[
{"id":"gmo","name":"Global MU Online","url":"https://globalmuonline.com","credit":"Guias de mapas do Global MU Online (globalmuonline.com), servidor privado Season 21. Uso só local até haver autorização.","pages":54,"first_scraped_at":"2026-10-21T20:18:48Z","last_scraped_at":"2026-10-21T20:22:15Z"}
]
